{
  "version": 1,
  "profile": "dotnet",
  "when": {
    "any_path": [
      "**/*.sln",
      "**/*.slnx",
      "**/*.csproj",
      "**/Directory.Build.props"
    ]
  },
  "checks": [
    {
      "id": "verify-build-command",
      "section": "Harness",
      "detect": {
        "any_path": [
          "Makefile",
          "build.sh",
          "build.ps1",
          "build.cmd",
          "scripts/build*",
          {
            "glob": "**/*.sln",
            "strength": "weak"
          },
          {
            "glob": "**/*.slnx",
            "strength": "weak"
          },
          {
            "glob": "**/*.csproj",
            "strength": "weak"
          }
        ]
      }
    },
    {
      "id": "verify-test-command",
      "section": "Harness",
      "detect": {
        "any_path": [
          "test.sh",
          "scripts/test.sh",
          {
            "glob": "**/*[Tt]ests*.csproj",
            "strength": "weak"
          },
          {
            "glob": "**/*[Tt]ests/**/*.cs",
            "strength": "weak"
          },
          {
            "glob": "**/*[Tt]est/**/*.csproj",
            "strength": "weak"
          },
          {
            "glob": "**/*[Tt]est/**/*.cs",
            "strength": "weak"
          }
        ]
      }
    },
    {
      "id": "dotnet-analyzers",
      "consumer": "ops-change",
      "action": "verify",
      "severity": "quality",
      "section": "Backend",
      "title": "Analyzers are wired in and runnable by one command",
      "why": "Analyzer rules are this stack's written-down conventions in a form a machine can enforce. Configured but only visible inside an IDE means an agent never sees them.",
      "detect": {
        "any_path": [
          "**/stylecop.json",
          "**/*.ruleset",
          "**/.globalconfig"
        ],
        "any_file_contains": [
          {
            "glob": "**/Directory.Build.props",
            "pattern": "Analyzer|StyleCop|TreatWarningsAsErrors|EnforceCodeStyleInBuild",
            "strength": "weak"
          },
          {
            "glob": "**/.editorconfig",
            "pattern": "dotnet_diagnostic|dotnet_analyzer",
            "strength": "weak"
          }
        ]
      },
      "ask": "Are analyzers enforced by the build here, and does one command run them?"
    },
    {
      "id": "dotnet-runnable-instance",
      "consumer": "ops-workspace",
      "action": "prepare",
      "severity": "blocking",
      "section": "Environment",
      "title": "A script stands up a running instance with this project installed",
      "why": "An agent that cannot start the product cannot check its change by hand or run anything end to end. This is the single biggest difference between a repo the loops do good work in and one they do not.",
      "detect": {
        "any_path": [
          "scripts/*demo*",
          {
            "glob": "**/docker-compose*.yml",
            "strength": "weak"
          },
          {
            "glob": "**/compose*.yml",
            "strength": "weak"
          },
          {
            "glob": "**/Dockerfile",
            "strength": "weak"
          },
          {
            "glob": "scripts/*install*",
            "strength": "weak"
          },
          {
            "glob": "scripts/*run*",
            "strength": "weak"
          },
          {
            "glob": "**/*[Tt]est[Ss]ite*/**/*.csproj",
            "strength": "weak"
          },
          {
            "glob": "**/*[Dd]emo*/**/*.csproj",
            "strength": "weak"
          },
          {
            "glob": "examples/**/*.csproj",
            "strength": "weak"
          },
          {
            "glob": "**/Properties/launchSettings.json",
            "strength": "weak"
          }
        ]
      },
      "ask": "What stands up a running instance of the product with this project installed?"
    },
    {
      "id": "dotnet-private-feed",
      "consumer": "ops-workspace",
      "action": "prepare",
      "severity": "blocking",
      "section": "Environment",
      "title": "A restore in a fresh worktree needs no credential",
      "why": "A restore that needs a feed credential fails inside the bare copy of the repo each change gets, and the failure reads as a broken build rather than a missing secret.",
      "signal": true,
      "detect": {
        "any_path": [
          "NuGet.Config",
          "**/NuGet.config",
          "**/nuget.config"
        ]
      },
      "ask": "Does restoring this repo need a credential for a private package feed?"
    },
    {
      "id": "verify-warnings-clean",
      "section": "Harness",
      "detect": {
        "any_file_contains": [
          {
            "glob": "**/Directory.Build.props",
            "pattern": "TreatWarningsAsErrors>[[:space:]]*[Tt]rue"
          },
          {
            "glob": "**/*.csproj",
            "pattern": "TreatWarningsAsErrors>[[:space:]]*[Tt]rue",
            "strength": "weak"
          },
          {
            "glob": "**/.globalconfig",
            "pattern": "severity[[:space:]]*=[[:space:]]*error",
            "strength": "weak"
          }
        ]
      }
    },
    {
      "id": "workspace-parallel",
      "section": "Environment",
      "detect": {
        "any_file_contains": [
          {
            "glob": "**/Properties/launchSettings.json",
            "pattern": "applicationUrl.*:[0-9]{4,5}|sslPort.*[0-9]{4,5}",
            "strength": "weak"
          }
        ]
      }
    }
  ]
}
